Reading OpenROAD database at '/home/dt/Documents/madvlsi/final/schematics/controller/librelane/runs/RUN_2025-11-16_00-46-24/38-openroad-globalrouting/controller.odb'…
Reading library file at '/usr/local/share/pdk/ciel/sky130/versions/0fe599b2afb6708d281543108caf8310912f54af/sky130A/libs.ref/sky130_fd_sc_hd/lib/sky130_fd_sc_hd__tt_025C_1v80.lib'…
Reading design constraints file at '/nix/store/pqxyc4xmydcs5adig47yyc29r3svp5nx-python3-3.11.9-env/lib/python3.11/site-packages/librelane/scripts/base.sdc'…
[INFO] Using clock clk…
[INFO] Setting output delay to: 10
[INFO] Setting input delay to: 10
[INFO] Setting load to: 0.033442
[INFO] Setting clock uncertainty to: 0.25
[INFO] Setting clock transition to: 0.1499999999999999944488848768742172978818416595458984375
[INFO] Setting timing derate to: 5%
[INFO] Setting signal min routing layer to: met1 and clock min routing layer to met1. 
[INFO] Setting signal max routing layer to: met4 and clock max routing layer to met4. 
-congestion_iterations 50 -verbose
[INFO GRT-0020] Min routing layer: met1
[INFO GRT-0021] Max routing layer: met4
[INFO GRT-0022] Global adjustment: 30%
[INFO GRT-0023] Grid origin: (0, 0)
[INFO GRT-0043] No OR_DEFAULT vias defined.
[INFO GRT-0088] Layer li1     Track-Pitch = 0.4600  line-2-Via Pitch: 0.3400
[INFO GRT-0088] Layer met1    Track-Pitch = 0.3400  line-2-Via Pitch: 0.3400
[INFO GRT-0088] Layer met2    Track-Pitch = 0.4600  line-2-Via Pitch: 0.3500
[INFO GRT-0088] Layer met3    Track-Pitch = 0.6800  line-2-Via Pitch: 0.6150
[INFO GRT-0088] Layer met4    Track-Pitch = 0.9200  line-2-Via Pitch: 0.6150
[INFO GRT-0019] Found 4 clock nets.
[INFO GRT-0001] Minimum degree: 2
[INFO GRT-0002] Maximum degree: 12
[INFO GRT-0003] Macros: 0
[INFO GRT-0043] No OR_DEFAULT vias defined.
[INFO GRT-0004] Blockages: 280

[INFO GRT-0053] Routing resources analysis:
          Routing      Original      Derated      Resource
Layer     Direction    Resources     Resources    Reduction (%)
---------------------------------------------------------------
li1        Vertical            0             0          0.00%
met1       Horizontal       3325          1645          50.53%
met2       Vertical         1995          1260          36.84%
met3       Horizontal       1652          1000          39.47%
met4       Vertical          931           496          46.72%
---------------------------------------------------------------

[INFO GRT-0197] Via related to pin nodes: 477
[INFO GRT-0198] Via related Steiner nodes: 4
[INFO GRT-0199] Via filling finished.
[INFO GRT-0111] Final number of vias: 587
[INFO GRT-0112] Final usage 3D: 2088

[INFO GRT-0096] Final congestion report:
Layer         Resource        Demand        Usage (%)    Max H / Max V / Total Overflow
---------------------------------------------------------------------------------------
li1                  0             0            0.00%             0 /  0 /  0
met1              1645           210           12.77%             0 /  0 /  0
met2              1260           101            8.02%             0 /  0 /  0
met3              1000            16            1.60%             0 /  0 /  0
met4               496             0            0.00%             0 /  0 /  0
---------------------------------------------------------------------------------------
Total             4401           327            7.43%             0 /  0 /  0

[INFO GRT-0018] Total wirelength: 3739 um
[INFO GRT-0014] Routed nets: 112
[INFO GRT-0006] Repairing antennas, iteration 1.
[INFO GRT-0043] No OR_DEFAULT vias defined.
[INFO GRT-0012] Found 1 antenna violations.
[INFO GRT-0015] Inserted 1 diodes.
[INFO GRT-0009] rerouting 29 nets.
[INFO GRT-0001] Minimum degree: 2
[INFO GRT-0002] Maximum degree: 11
[INFO GRT-0006] Repairing antennas, iteration 2.
[INFO GRT-0043] No OR_DEFAULT vias defined.
[INFO GRT-0012] Found 1 antenna violations.
[INFO GRT-0015] Inserted 1 diodes.
[INFO GRT-0009] rerouting 1 nets.
[INFO GRT-0001] Minimum degree: 6
[INFO GRT-0002] Maximum degree: 6
[INFO GRT-0006] Repairing antennas, iteration 3.
[INFO GRT-0043] No OR_DEFAULT vias defined.
[INFO GRT-0012] Found 1 antenna violations.
[INFO GRT-0015] Inserted 1 diodes.
[INFO GRT-0009] rerouting 1 nets.
[INFO GRT-0001] Minimum degree: 7
[INFO GRT-0002] Maximum degree: 7
Placement Analysis
---------------------------------
total displacement          0.0 u
average displacement        0.0 u
max displacement            0.0 u
original HPWL            2294.0 u
legalized HPWL           2294.0 u
delta HPWL                    0 %

[INFO DPL-0020] Mirrored 51 instances
[INFO DPL-0021] HPWL before            2294.0 u
[INFO DPL-0022] HPWL after             2203.1 u
[INFO DPL-0023] HPWL delta               -4.0 %
-congestion_iterations 50 -verbose
[INFO GRT-0020] Min routing layer: met1
[INFO GRT-0021] Max routing layer: met4
[INFO GRT-0022] Global adjustment: 30%
[INFO GRT-0023] Grid origin: (0, 0)
[INFO GRT-0043] No OR_DEFAULT vias defined.
[INFO GRT-0088] Layer li1     Track-Pitch = 0.4600  line-2-Via Pitch: 0.3400
[INFO GRT-0088] Layer met1    Track-Pitch = 0.3400  line-2-Via Pitch: 0.3400
[INFO GRT-0088] Layer met2    Track-Pitch = 0.4600  line-2-Via Pitch: 0.3500
[INFO GRT-0088] Layer met3    Track-Pitch = 0.6800  line-2-Via Pitch: 0.6150
[INFO GRT-0088] Layer met4    Track-Pitch = 0.9200  line-2-Via Pitch: 0.6150
[INFO GRT-0019] Found 4 clock nets.
[INFO GRT-0001] Minimum degree: 2
[INFO GRT-0002] Maximum degree: 12
[INFO GRT-0003] Macros: 0
[INFO GRT-0043] No OR_DEFAULT vias defined.
[INFO GRT-0004] Blockages: 280

[INFO GRT-0053] Routing resources analysis:
          Routing      Original      Derated      Resource
Layer     Direction    Resources     Resources    Reduction (%)
---------------------------------------------------------------
li1        Vertical            0             0          0.00%
met1       Horizontal       3325          1645          50.53%
met2       Vertical         1995          1260          36.84%
met3       Horizontal       1652          1000          39.47%
met4       Vertical          931           496          46.72%
---------------------------------------------------------------

[INFO GRT-0197] Via related to pin nodes: 480
[INFO GRT-0198] Via related Steiner nodes: 4
[INFO GRT-0199] Via filling finished.
[INFO GRT-0111] Final number of vias: 591
[INFO GRT-0112] Final usage 3D: 2101

[INFO GRT-0096] Final congestion report:
Layer         Resource        Demand        Usage (%)    Max H / Max V / Total Overflow
---------------------------------------------------------------------------------------
li1                  0             0            0.00%             0 /  0 /  0
met1              1645           210           12.77%             0 /  0 /  0
met2              1260           102            8.10%             0 /  0 /  0
met3              1000            16            1.60%             0 /  0 /  0
met4               496             0            0.00%             0 /  0 /  0
---------------------------------------------------------------------------------------
Total             4401           328            7.45%             0 /  0 /  0

[INFO GRT-0018] Total wirelength: 3753 um
[INFO GRT-0014] Routed nets: 112
[INFO] Setting RC values…
Setting global connections for newly added cells…
[INFO] Setting global connections...
Updating metrics…
Cell type report:                       Count       Area
  Fill cell                                20      75.07
  Tap cell                                 60      75.07
  Antenna cell                              3       7.51
  Clock buffer                              4      88.84
  Timing Repair Buffer                     34     235.23
  Inverter                                  8      30.03
  Sequential cell                          20     401.64
  Multi-Input combinational cell           44     375.36
  Total                                   193    1288.74
Writing OpenROAD database to '/home/dt/Documents/madvlsi/final/schematics/controller/librelane/runs/RUN_2025-11-16_00-46-24/41-openroad-repairantennas/1-diodeinsertion/controller.odb'…
Writing layout to '/home/dt/Documents/madvlsi/final/schematics/controller/librelane/runs/RUN_2025-11-16_00-46-24/41-openroad-repairantennas/1-diodeinsertion/controller.def'…
